{
  "$schema":"https://json-schema.org/draft/2020-12/schema",
  "$id":"https://breach.local/contracts/collector-v1.schema.json",
  "title":"BREACH PC replay collector envelope 1.0.0",
  "description":"Draft local export and future authenticated ingestion contract. No account or workspace ownership is trusted from this body.",
  "type":"object","additionalProperties":false,
  "required":["schemaVersion","messageId","collector","source","payload"],
  "properties":{
    "schemaVersion":{"const":"1.0.0"},"messageId":{"$ref":"#/$defs/uuid"},
    "collector":{"type":"object","additionalProperties":false,"required":["installationId","version"],"properties":{"installationId":{"$ref":"#/$defs/uuid"},"version":{"type":"string","minLength":1,"maxLength":50}}},
    "source":{"type":"object","additionalProperties":false,"required":["kind","parserName","parserVersion","normalizerVersion","gameVersion","collectedAt"],"properties":{"kind":{"const":"pc-replay"},"parserName":{"type":"string","minLength":1,"maxLength":80},"parserVersion":{"type":"string","minLength":1,"maxLength":50},"normalizerVersion":{"type":"string","minLength":1,"maxLength":50},"gameVersion":{"type":"string","minLength":1,"maxLength":100},"collectedAt":{"type":"string","format":"date-time","pattern":"Z$"}}},
    "payload":{"type":"object","additionalProperties":false,"required":["match","rounds","players","appearances","events","issues"],"properties":{
      "match":{"type":"object","additionalProperties":false,"required":["matchId","mapId","mapName","playedAt","recordingProfileId","completion","matchType","gameMode"],"properties":{"matchId":{"$ref":"#/$defs/uuid"},"mapId":{"$ref":"#/$defs/nullableDecimalId"},"mapName":{"type":["string","null"],"maxLength":100},"playedAt":{"type":["string","null"],"format":"date-time","pattern":"Z$"},"recordingProfileId":{"anyOf":[{"$ref":"#/$defs/uuid"},{"type":"null"}]},"roundsPerMatch":{"type":["integer","null"],"minimum":1,"maximum":24},"roundsPerMatchOvertime":{"type":["integer","null"],"minimum":0,"maximum":12},"completion":{"enum":["complete","incomplete","unknown"]},"matchType":{"type":["string","null"],"maxLength":80},"gameMode":{"type":["string","null"],"maxLength":80}}},
      "rounds":{"type":"array","minItems":1,"maxItems":100,"items":{"type":"object","additionalProperties":false,"required":["roundId","number","site","sourceSha256","teams"],"properties":{"roundId":{"$ref":"#/$defs/entityId"},"number":{"type":"integer","minimum":1,"maximum":100},"site":{"type":["string","null"],"maxLength":200},"sourceSha256":{"type":"string","pattern":"^[a-f0-9]{64}$"},"teams":{"type":"array","minItems":2,"maxItems":2,"items":{"type":"object","additionalProperties":false,"required":["slot","side","won"],"properties":{"slot":{"enum":[0,1]},"side":{"enum":["ATK","DEF","UNKNOWN"]},"won":{"type":["boolean","null"]}}}}}}},
      "players":{"type":"array","minItems":1,"maxItems":100,"items":{"type":"object","additionalProperties":false,"required":["playerId","profileId","username"],"properties":{"playerId":{"$ref":"#/$defs/entityId"},"profileId":{"anyOf":[{"$ref":"#/$defs/uuid"},{"type":"null"}]},"username":{"type":"string","minLength":1,"maxLength":100}}}},
      "appearances":{"type":"array","maxItems":10000,"items":{"type":"object","additionalProperties":false,"required":["roundId","playerId","teamIndex","operatorId","operatorName","stats"],"properties":{"roundId":{"$ref":"#/$defs/entityId"},"playerId":{"$ref":"#/$defs/entityId"},"teamIndex":{"enum":[0,1,null]},"operatorId":{"$ref":"#/$defs/nullableDecimalId"},"operatorName":{"type":["string","null"],"maxLength":100},"stats":{"type":"object","additionalProperties":false,"required":["kills","died","assists","headshots","damageDealt","damageTaken","scoreSnapshot"],"properties":{"impact":{"anyOf":[{"$ref":"#/$defs/impact"},{"type":"null"}]},"kills":{"$ref":"#/$defs/nullableCount"},"died":{"type":["boolean","null"]},"assists":{"$ref":"#/$defs/nullableCount"},"headshots":{"$ref":"#/$defs/nullableCount"},"damageDealt":{"$ref":"#/$defs/nullableCount"},"damageTaken":{"$ref":"#/$defs/nullableCount"},"scoreSnapshot":{"type":["integer","null"],"minimum":-2147483648,"maximum":4294967295}}}}}},
      "events":{"type":"array","maxItems":20000,"items":{"type":"object","additionalProperties":false,"required":["eventId","roundId","sequence","type","actorPlayerId","targetPlayerId","actorUsername","targetUsername","timeRemainingSeconds","headshot","weaponId"],"properties":{"eventId":{"$ref":"#/$defs/entityId"},"roundId":{"$ref":"#/$defs/entityId"},"sequence":{"type":"integer","minimum":0},"type":{"type":"string","minLength":1,"maxLength":80},"actorPlayerId":{"anyOf":[{"$ref":"#/$defs/entityId"},{"type":"null"}]},"targetPlayerId":{"anyOf":[{"$ref":"#/$defs/entityId"},{"type":"null"}]},"actorUsername":{"type":["string","null"],"maxLength":100},"targetUsername":{"type":["string","null"],"maxLength":100},"timeRemainingSeconds":{"type":["number","null"],"minimum":0,"maximum":3600},"headshot":{"type":["boolean","null"]},"weaponId":{"$ref":"#/$defs/nullableDecimalId"}}}},
      "issues":{"type":"array","maxItems":1000,"items":{"type":"object","additionalProperties":false,"required":["severity","code","message"],"properties":{"severity":{"enum":["info","warning","error"]},"code":{"type":"string","minLength":1,"maxLength":80},"message":{"type":"string","minLength":1,"maxLength":1000}}}}
    }}
  },
  "$defs":{
    "impact":{"type":"object","additionalProperties":false,"required":["version","openingKills","openingDeaths","openingTeamkills","openingTeamkillDeaths","openingOtherDeaths","clutches"],"properties":{"version":{"const":1},"openingKills":{"type":["integer","null"],"minimum":0,"maximum":1},"openingDeaths":{"type":["integer","null"],"minimum":0,"maximum":1},"openingTeamkills":{"type":["integer","null"],"minimum":0,"maximum":1},"openingTeamkillDeaths":{"type":["integer","null"],"minimum":0,"maximum":1},"openingOtherDeaths":{"type":["integer","null"],"minimum":0,"maximum":1},"clutches":{"type":"array","minItems":5,"maxItems":5,"items":{"type":["integer","null"],"minimum":0,"maximum":1}}}},"entityId":{"type":"string","minLength":1,"maxLength":100,"pattern":"^[A-Za-z0-9][A-Za-z0-9._:-]{0,99}$"},"uuid":{"type":"string","format":"uuid","pattern":"^[a-fA-F0-9]{8}-[a-fA-F0-9]{4}-[a-fA-F0-9]{4}-[a-fA-F0-9]{4}-[a-fA-F0-9]{12}$"},"nullableDecimalId":{"type":["string","null"],"pattern":"^[0-9]{1,20}$"},"nullableCount":{"type":["integer","null"],"minimum":0,"maximum":2147483647}}
}
